{
  "fixtureVersion": "lease-ground-truth/1.0",
  "fixtureId": "macon-crossing-tnn-2019",
  "documentName": "Macon Crossing Triple Net Lease",
  "documentType": "lease",
  "propertyType": "retail",
  "sourceFile": "manual://macon-crossing-triple-net-lease.pdf",
  "expectedDocumentPages": null,
  "expectedFields": [
    { "canonicalFieldKey": "landlord_name", "scopeKey": null, "domain": "parties_and_premises", "expectation": "value", "normalizedValue": "Macon Crossing", "criticality": "critical", "expectedEvidence": [{ "page": 1, "requiredTextAll": ["Macon Crossing", "Landlord"], "clauseCategory": "party_identification", "allowEquivalentSpan": true }] },
    { "canonicalFieldKey": "tenant_name", "scopeKey": null, "domain": "parties_and_premises", "expectation": "value", "normalizedValue": "Justin Cress", "criticality": "critical", "expectedEvidence": [{ "page": 1, "requiredTextAll": ["Justin Cress", "Tenant"], "clauseCategory": "party_identification", "allowEquivalentSpan": true }] },
    { "canonicalFieldKey": "property_name", "scopeKey": null, "domain": "parties_and_premises", "expectation": "value", "normalizedValue": "Macon Crossing Shopping Center", "criticality": "critical", "expectedEvidence": [{ "page": 1, "requiredTextAll": ["Macon Crossing Shopping Center"], "forbiddenText": ["one (1) day in each calendar year"], "clauseCategory": "premises_description", "allowEquivalentSpan": true }] },
    { "canonicalFieldKey": "property_address", "scopeKey": null, "domain": "parties_and_premises", "expectation": "value", "normalizedValue": "10721 Chapman Highway #21, Seymour, Sevier County, Tennessee", "acceptedAlternativeValues": ["10721 Chapman Hwy #21, Seymour, Sevier County, Tennessee"], "criticality": "critical", "expectedEvidence": [{ "page": 1, "requiredTextAll": ["10721 Chapman", "#21", "Seymour", "Tennessee"], "clauseCategory": "premises_description", "allowEquivalentSpan": true }] },
    { "canonicalFieldKey": "unit_number", "scopeKey": null, "domain": "parties_and_premises", "expectation": "value", "normalizedValue": "#21", "acceptedAlternativeValues": ["21", "Suite #21"], "criticality": "high", "expectedEvidence": [{ "page": 1, "requiredTextAny": ["#21", "Suite #21"], "forbiddenText": ["one (1) day"], "clauseCategory": "premises_description", "allowEquivalentSpan": true }] },
    { "canonicalFieldKey": "square_footage", "scopeKey": null, "domain": "parties_and_premises", "expectation": "value", "normalizedValue": 1875, "acceptedAlternativeValues": ["approximately 1,875 square feet", "1875 square feet"], "criticality": "critical", "expectedEvidence": [{ "page": 1, "requiredTextAny": ["1,875", "1875"], "requiredTextAll": ["square feet"], "clauseCategory": "premises_description", "allowEquivalentSpan": true }] },
    { "canonicalFieldKey": "permitted_use", "scopeKey": null, "domain": "parties_and_premises", "expectation": "value", "normalizedValue": "restaurant and related sales", "criticality": "high", "expectedEvidence": [{ "page": 1, "requiredTextAll": ["restaurant", "related sales"], "clauseCategory": "use", "allowEquivalentSpan": true }] },
    { "canonicalFieldKey": "annual_rent", "scopeKey": null, "domain": "rent_and_charges", "expectation": "value", "normalizedValue": 25200, "acceptedAlternativeValues": ["$25,200"], "criticality": "critical", "expectedEvidence": [{ "page": 1, "requiredTextAny": ["25,200", "Twenty Five Thousand Two Hundred"], "clauseCategory": "rent", "allowEquivalentSpan": true }] },
    { "canonicalFieldKey": "monthly_rent", "scopeKey": null, "domain": "rent_and_charges", "expectation": "value", "normalizedValue": 2100, "acceptedAlternativeValues": ["$2,100"], "criticality": "critical", "expectedEvidence": [{ "page": 1, "requiredTextAll": ["2,100", "month"], "clauseCategory": "rent", "allowEquivalentSpan": true }] },
    { "canonicalFieldKey": "rent_commencement_date", "scopeKey": null, "domain": "dates_and_term", "expectation": "value", "normalizedValue": "2019-03-01", "acceptedAlternativeValues": ["March 1, 2019"], "criticality": "critical", "expectedEvidence": [{ "page": 1, "requiredTextAll": ["March 1, 2019"], "clauseCategory": "term", "allowEquivalentSpan": true }] },
    { "canonicalFieldKey": "expiration_date", "scopeKey": null, "domain": "dates_and_term", "expectation": "value", "normalizedValue": "2023-12-31", "acceptedAlternativeValues": ["December 31, 2023"], "criticality": "critical", "expectedEvidence": [{ "page": 1, "requiredTextAll": ["December 31, 2023"], "clauseCategory": "term", "allowEquivalentSpan": true }] },
    { "canonicalFieldKey": "security_deposit", "scopeKey": null, "domain": "rent_and_charges", "expectation": "value", "normalizedValue": 0, "acceptedAlternativeValues": ["$0", "0"], "criticality": "high", "expectedEvidence": [{ "page": 1, "requiredTextAny": ["security deposit", "$0"], "clauseCategory": "rent", "allowEquivalentSpan": true }] },
    { "canonicalFieldKey": "billing_frequency", "scopeKey": null, "domain": "rent_and_charges", "expectation": "value", "normalizedValue": "monthly in advance on or before the first day of each month", "acceptedAlternativeValues": ["in advance on or before the first day of each month"], "criticality": "high", "expectedEvidence": [{ "page": 1, "requiredTextAll": ["in advance", "first day of each month"], "clauseCategory": "rent", "allowEquivalentSpan": true }] },
    { "canonicalFieldKey": "lease_term_months", "scopeKey": null, "domain": "dates_and_term", "expectation": "value", "normalizedValue": "stated five-year period with explicit March 1, 2019 to December 31, 2023 dates", "criticality": "high", "expectedEvidence": [{ "page": 1, "requiredTextAny": ["five-year", "five year"], "requiredTextAll": ["March 1, 2019", "December 31, 2023"], "clauseCategory": "term", "allowEquivalentSpan": true }], "notes": "The five-year text and explicit dates must survive as a consistency warning, not an overwrite." },
    { "canonicalFieldKey": "responsibility_taxes", "scopeKey": null, "domain": "taxes", "expectation": "value", "normalizedValue": "tenant reimburses real estate taxes through annual adjustments; tenant separately bears personal property taxes", "acceptedAlternativeValues": ["tenant"], "criticality": "critical", "expectedEvidence": [{ "page": 1, "requiredTextAny": ["real estate taxes", "personal property taxes"], "forbiddenText": ["waiver of subrogation"], "clauseCategory": "taxes", "allowEquivalentSpan": true }] },
    { "canonicalFieldKey": "responsibility_insurance", "scopeKey": null, "domain": "insurance", "expectation": "value", "normalizedValue": "tenant obtains liability insurance; tenant bears landlord insurance premiums through adjustments", "acceptedAlternativeValues": ["tenant"], "criticality": "critical", "expectedEvidence": [{ "page": 1, "requiredTextAny": ["liability insurance", "insurance premiums"], "forbiddenText": ["waiver of subrogation"], "clauseCategory": "insurance", "allowEquivalentSpan": true }] },
    { "canonicalFieldKey": "tenant_insurance_required", "scopeKey": null, "domain": "insurance", "expectation": "value", "normalizedValue": true, "criticality": "critical", "expectedEvidence": [{ "page": 1, "requiredTextAll": ["obtain", "liability insurance"], "clauseCategory": "insurance", "allowEquivalentSpan": true }] },
    { "canonicalFieldKey": "general_liability_min", "scopeKey": null, "domain": "insurance", "expectation": "value", "normalizedValue": "$1,000,000 one person / $2,000,000 more than one person", "acceptedAlternativeValues": ["1000000/2000000", "$1,000,000 / $2,000,000"], "criticality": "critical", "expectedEvidence": [{ "page": 1, "requiredTextAll": ["1,000,000", "2,000,000"], "clauseCategory": "insurance", "allowEquivalentSpan": true }] },
    { "canonicalFieldKey": "waiver_of_subrogation", "scopeKey": null, "domain": "insurance", "expectation": "value", "normalizedValue": true, "criticality": "high", "expectedEvidence": [{ "page": 1, "requiredTextAll": ["waiver", "subrogation"], "clauseCategory": "insurance", "allowEquivalentSpan": true }] },
    { "canonicalFieldKey": "responsibility_utilities", "scopeKey": null, "domain": "utilities", "expectation": "value", "normalizedValue": "tenant responsible for water, gas, heat, light or power, sewer, telephone and other supplied utilities; joint meters allocated reasonably by landlord", "acceptedAlternativeValues": ["tenant"], "criticality": "critical", "expectedEvidence": [{ "page": 1, "requiredTextAny": ["water", "gas", "heat", "light", "power", "sewer", "telephone"], "forbiddenText": ["wiring"], "clauseCategory": "utilities", "allowEquivalentSpan": true }] },
    { "canonicalFieldKey": "electric_responsibility", "scopeKey": null, "domain": "utilities", "expectation": "value", "normalizedValue": "tenant", "criticality": "critical", "expectedEvidence": [{ "page": 1, "requiredTextAny": ["light", "power"], "forbiddenText": ["wiring", "repair"], "clauseCategory": "utilities", "allowEquivalentSpan": true }] },
    { "canonicalFieldKey": "water_sewer_responsibility", "scopeKey": null, "domain": "utilities", "expectation": "value", "normalizedValue": "tenant", "criticality": "high", "expectedEvidence": [{ "page": 1, "requiredTextAny": ["water", "sewer"], "clauseCategory": "utilities", "allowEquivalentSpan": true }] },
    { "canonicalFieldKey": "responsibility_repairs", "scopeKey": null, "domain": "repairs", "expectation": "value", "normalizedValue": "split_by_component", "acceptedAlternativeValues": ["shared", "split"], "criticality": "critical", "expectedEvidence": [{ "page": 1, "requiredTextAny": ["storefront", "doors", "glass", "windows", "plumbing", "electrical", "HVAC", "exterior walls", "roof"], "clauseCategory": "repairs", "allowEquivalentSpan": true }] },